city,hotel_name,hotel_url,hotel_address,hotel_latitude,hotel_longitude,hotel_score,hotel_description,id,city_new_name,lat_city,lon_city,daily_temperature,wind,rain,weather_score
Aix en Provence,Hôtel Escaletto,https://www.booking.com/hotel/fr/hotel-escaletto.fr.html?aid=304142&label=gen173nr-1FCAQoggJCFnNlYXJjaF9haXgtZW4tcHJvdmVuY2VIDVgEaE2IAQGYAQ24AQfIAQzYAQHoAQH4AQOIAgGoAgO4Avbfh6QGwAIB0gIkYTE1NWMzZjQtMDE5Ny00ZGUxLWI3MWMtZjUwODU5ZDgxNjMz2AIF4AIB&ucfs=1&arphpl=1&group_adults=2&req_adults=2&no_rooms=1&group_children=0&req_children=0&hpos=12&hapos=12&sr_order=popularity&srpvid=15c56afb21ce032d&srepoch=1686237176&from_sustainable_property_sr=1&from=searchresults#hotelTmpl,"74, cours Sextius, 13100 Aix-en-Provence, France",43.53004967,5.44414669,8.3,"[""Vous pouvez bénéficier d'une réduction Genius dans l'établissement Hôtel Escaletto ! Connectez-vous pour économiser.\nÉtablissement 3 étoiles, l’Hôtel Escaletto vous accueille dans le centre-ville d’Aix-en-Provence, à 1 minute à pied des Thermes Sextius et à 550 mètres du cours Mirabeau. Une connexion Wi-Fi est disponible gratuitement.\n\nAménagées dans un style contemporain, les chambres bénéficient d’une terrasse offrant une vue panoramique sur la ville et la montagne Sainte-Victoire.\n\nChaque matin, vous pourrez savourer un petit-déjeuner buffet. La connexion Wi-Fi gratuite est accessible dans l’ensemble de l’hôtel.\n\nDoté d’une réception ouverte 24h/24, l’Hôtel Escaletto offre un accès facile à toutes les principales attractions touristiques\nd’Aix-en-Provence.""]",21,Aix+en+Provence,43.5298424,5.4474738,"[25.8, 24.85, 27.14, 27.22, 28.37, 28.92, 28.37]","[5.89, 6.36, 6.22, 7.33, 3.6, 5.05, 6.18]","[1, 1, 0.03, 0, 0, 0, 0.25]",51.249
Aix en Provence,Hôtel Le Mozart,https://www.booking.com/hotel/fr/le-mozart.fr.html?aid=304142&label=gen173nr-1FCAQoggJCFnNlYXJjaF9haXgtZW4tcHJvdmVuY2VIDVgEaE2IAQGYAQ24AQfIAQzYAQHoAQH4AQOIAgGoAgO4Avbfh6QGwAIB0gIkYTE1NWMzZjQtMDE5Ny00ZGUxLWI3MWMtZjUwODU5ZDgxNjMz2AIF4AIB&ucfs=1&arphpl=1&group_adults=2&req_adults=2&no_rooms=1&group_children=0&req_children=0&hpos=14&hapos=14&sr_order=popularity&srpvid=15c56afb21ce032d&srepoch=1686237176&from=searchresults#hotelTmpl,"49 Cours Gambetta, 13100 Aix-en-Provence, France",43.52191762,5.45787156,8.3,"[""Situé à 500 mètres du musée Granet, l'Hôtel Le Mozart propose des chambres climatisées avec connexion Wi-Fi gratuite. Il est facilement accessible depuis l'autoroute A8, à 3 minutes de route.\n\nLes chambres comprennent une télévision par satellite à écran LCD. Elles disposent également d'un téléphone et d'une salle de bains privative avec baignoire ou douche.\n\nLe petit-déjeuner buffet est servi dans la salle à manger ou sur la terrasse.\n\nUn parking privé est accessible gratuitement sur place. Vous pourrez garer votre véhicule dans le parking intérieur surveillé moyennant des frais supplémentaires et sur réservation. Vous trouverez des journaux à la réception ouverte 24h/24.""]",21,Aix+en+Provence,43.5298424,5.4474738,"[25.8, 24.85, 27.14, 27.22, 28.37, 28.92, 28.37]","[5.89, 6.36, 6.22, 7.33, 3.6, 5.05, 6.18]","[1, 1, 0.03, 0, 0, 0, 0.25]",51.249
Aix en Provence,Séjours & Affaires Aix-en-Provence Mirabeau,https://www.booking.com/hotel/fr/residence-mirabeau.fr.html?aid=304142&label=gen173nr-1FCAQoggJCFnNlYXJjaF9haXgtZW4tcHJvdmVuY2VIDVgEaE2IAQGYAQ24AQfIAQzYAQHoAQH4AQOIAgGoAgO4Avbfh6QGwAIB0gIkYTE1NWMzZjQtMDE5Ny00ZGUxLWI3MWMtZjUwODU5ZDgxNjMz2AIF4AIB&ucfs=1&arphpl=1&group_adults=2&req_adults=2&no_rooms=1&group_children=0&req_children=0&hpos=3&hapos=3&sr_order=popularity&srpvid=15c56afb21ce032d&srepoch=1686237176&from=searchresults#hotelTmpl,"615 Avenue Wolfgang Amadeus Mozart, 13100 Aix-en-Provence, France",43.52524078,5.441266,8.0,"[""Cette résidence Séjours & Affaires est située à Aix-en-Provence, à proximité du cours Mirabeau. Elle propose des studios meublés et une connexion Wi-Fi gratuite.\n\nTous les studios du Séjours & Affaires Aix-en-Provence Mirabeau sont insonorisés et disposent d'une kitchenette complète équipée d'un réfrigérateur, d'un four micro-ondes, de plaques de cuisson et de vaisselle. Ils sont tous desservis par un ascenseur.\n\nLes studios comprennent un canapé-lit, et le ménage, qui inclut le changement du linge, est effectué une fois par semaine.""]",21,Aix+en+Provence,43.5298424,5.4474738,"[25.8, 24.85, 27.14, 27.22, 28.37, 28.92, 28.37]","[5.89, 6.36, 6.22, 7.33, 3.6, 5.05, 6.18]","[1, 1, 0.03, 0, 0, 0, 0.25]",51.249
Aix en Provence,La Caravelle,https://www.booking.com/hotel/fr/la-caravelle-aix-en-provence.fr.html?aid=304142&label=gen173nr-1FCAQoggJCFnNlYXJjaF9haXgtZW4tcHJvdmVuY2VIDVgEaE2IAQGYAQ24AQfIAQzYAQHoAQH4AQOIAgGoAgO4Avbfh6QGwAIB0gIkYTE1NWMzZjQtMDE5Ny00ZGUxLWI3MWMtZjUwODU5ZDgxNjMz2AIF4AIB&ucfs=1&arphpl=1&group_adults=2&req_adults=2&no_rooms=1&group_children=0&req_children=0&hpos=15&hapos=15&sr_order=popularity&srpvid=15c56afb21ce032d&srepoch=1686237176&from=searchresults#hotelTmpl,"29, boulevard du Roi René, 13100 Aix-en-Provence, France",43.52485921,5.45370072,7.7,"[""Vous pouvez bénéficier d'une réduction Genius dans l'établissement La Caravelle ! Connectez-vous pour économiser.\nAu cœur d'Aix-en-Provence, l'hôtel La Caravelle vous accueille à moins de 8 minutes à pied du cours Mirabeau, du musée Granet et du palais des congrès.\n\nToutes les chambres disposent d'un ventilateur ou de la climatisation, d'un bureau, ainsi que d'une salle de bains privative munie d'une baignoire ou d'une douche.\n\nUn petit-déjeuner buffet vous sera servi tous les matins lors de votre séjour dans l'établissement La Caravelle. Un petit-déjeuner continental est également disponible à un tarif réduit. Il comprend une boisson chaude, un croissant et un verre de jus d'orange. Vous pourrez le déguster dans votre chambre.\n\nDoté d'un système de surveillance vidéo, l'hôtel La Caravelle propose l'accès gratuit aux ordinateurs dans les parties communes. Enfin, un parking public est accessible à proximité.""]",21,Aix+en+Provence,43.5298424,5.4474738,"[25.8, 24.85, 27.14, 27.22, 28.37, 28.92, 28.37]","[5.89, 6.36, 6.22, 7.33, 3.6, 5.05, 6.18]","[1, 1, 0.03, 0, 0, 0, 0.25]",51.249
Aix en Provence,Campanile Aix en Provence Ouest Jas-De-Bouffan,https://www.booking.com/hotel/fr/campanile-aix-en-provence-jas-de-bouffan.fr.html?aid=304142&label=gen173nr-1FCAQoggJCFnNlYXJjaF9haXgtZW4tcHJvdmVuY2VIDVgEaE2IAQGYAQ24AQfIAQzYAQHoAQH4AQOIAgGoAgO4Avbfh6QGwAIB0gIkYTE1NWMzZjQtMDE5Ny00ZGUxLWI3MWMtZjUwODU5ZDgxNjMz2AIF4AIB&ucfs=1&arphpl=1&group_adults=2&req_adults=2&no_rooms=1&group_children=0&req_children=0&hpos=19&hapos=19&sr_order=popularity&srpvid=15c56afb21ce032d&srepoch=1686237176&from=searchresults#hotelTmpl,"80 Route De Valcros, Zac De Jas-De-Bouffan, 13090 Aix-en-Provence, France",43.52096753,5.41811049,7.4,"[""Installé dans un grand parc, à 3 km du cours Mirabeau et de la Rotonde d’Aix en Provence, le Campanile Aix en Provence Ouest Jas-De-Bouffan propose des hébergements climatisés avec une télévision par satellite et une connexion Wi-Fi gratuite.\nRécemment rénovées, les chambres de l’hôtel sont dotées d'un plateau de bienvenue avec une bouilloire, du thé, du café et des pâtisseries. Elles comprennent également un bureau et une salle de bains privative.\nChaque jour, l’établissement sert un petit-déjeuner buffet et une cuisine régionale. Il met à votre disposition une salle de lecture avec des journaux gratuits.\nUn parking privé est disponible gratuitement sur place. Vous logerez à seulement 15 minutes en voiture de la gare TGV et de l’aéroport Marseille Provence.\nLa ville d’Aix-en-Provence, réputée pour son patrimoine historique et culturel, attire chaque année des touristes venus du monde entier. Ancienne capitale de la Provence, Aix-en-Provence est probablement aujourd’hui l’une des plus belles villes d’art françaises, une ville de culture par excellence. À l’hôtel, vous profiterez d’un cadre accueillant et d’hébergements confortables à un bon rapport qualité/prix. Le personnel sur place fera de son mieux pour rendre votre séjour aussi agréable que possible.\nLe Campanile Aix en Provence Ouest Jas-De-Bouffan possède également un parking, un bar, un restaurant, des salles de réunion, des aménagements pour les personnes à mobilité réduite et une réception ouverte 24h/24.""]",21,Aix+en+Provence,43.5298424,5.4474738,"[25.8, 24.85, 27.14, 27.22, 28.37, 28.92, 28.37]","[5.89, 6.36, 6.22, 7.33, 3.6, 5.05, 6.18]","[1, 1, 0.03, 0, 0, 0, 0.25]",51.249
Aix en Provence,Campanile Aix-en-Provence Sud - Pont de l'Arc,https://www.booking.com/hotel/fr/campanile-aix-en-provence-sud.fr.html?aid=304142&label=gen173nr-1FCAQoggJCFnNlYXJjaF9haXgtZW4tcHJvdmVuY2VIDVgEaE2IAQGYAQ24AQfIAQzYAQHoAQH4AQOIAgGoAgO4Avbfh6QGwAIB0gIkYTE1NWMzZjQtMDE5Ny00ZGUxLWI3MWMtZjUwODU5ZDgxNjMz2AIF4AIB&ucfs=1&arphpl=1&group_adults=2&req_adults=2&no_rooms=1&group_children=0&req_children=0&hpos=13&hapos=13&sr_order=popularity&srpvid=15c56afb21ce032d&srepoch=1686237176&from_sustainable_property_sr=1&from=searchresults#hotelTmpl,"1 Rue Jean Andreani, 13090 Aix-en-Provence, France",43.51191632,5.43665394,7.3,"['Installé à Aix-en-Provence, à 3 km du centre historique et du cours Mirabeau, le Campanile Aix-en-Provence Sud - Pont de l’Arc vous propose des hébergements climatisés avec une connexion Wi-Fi gratuite.\nToutes les chambres sont équipées d’une télévision à écran plat. Chaque logement est doté d’un plateau/bouilloire.\nL’hôtel sert tous les matins un petit-déjeuner buffet. Le restaurant sur place prépare une cuisine française contemporaine, que vous pourrez savourer sur la terrasse en été. Un buffet composé de plats chauds et froids est également disponible.\nL’hôtel possède un ascenseur et un parking privé gratuit sur place. Un bus desservant directement le centre-ville s’arrête en face de l’hôtel.\nL’établissement se trouve à 13 km de la gare TGV d’Aix-en-Provence et à 8 km de la salle polyvalente Arena du Pays d’Aix. L’aéroport Marseille-Provence est accessible en 20 minutes de route.']",21,Aix+en+Provence,43.5298424,5.4474738,"[25.8, 24.85, 27.14, 27.22, 28.37, 28.92, 28.37]","[5.89, 6.36, 6.22, 7.33, 3.6, 5.05, 6.18]","[1, 1, 0.03, 0, 0, 0, 0.25]",51.249
Aix en Provence,B&B HOTEL Aix-en-Provence Pont de l'Arc,https://www.booking.com/hotel/fr/b-amp-b-aix-en-provence-pont-de-l-39-arc.fr.html?aid=304142&label=gen173nr-1FCAQoggJCFnNlYXJjaF9haXgtZW4tcHJvdmVuY2VIDVgEaE2IAQGYAQ24AQfIAQzYAQHoAQH4AQOIAgGoAgO4Avbfh6QGwAIB0gIkYTE1NWMzZjQtMDE5Ny00ZGUxLWI3MWMtZjUwODU5ZDgxNjMz2AIF4AIB&ucfs=1&arphpl=1&group_adults=2&req_adults=2&no_rooms=1&group_children=0&req_children=0&hpos=25&hapos=25&sr_order=popularity&srpvid=15c56afb21ce032d&srepoch=1686237176&from=searchresults#hotelTmpl,"Avenue de l'Arc de Meyran, 13100 Aix-en-Provence, France",43.5111713,5.4446805,6.6,"[""Doté d'une connexion Wi-Fi gratuite, le B&B HOTEL Aix-en-Provence Pont de l'Arc est situé à Aix-en-Provence. Cet établissement 2 étoiles propose des chambres climatisées avec salle de bains privative. Le cours Mirabeau est à 2,3 km de là.\n\nAccessibles par un escalier, toutes les chambres sont équipées d'une télévision à écran plat.\n\nUn petit-déjeuner buffet est servi chaque matin. Un micro-ondes commun ainsi qu'un distributeur automatique de boissons et de collations sont à votre disposition..\n\nLa cathédrale Saint-Sauveur se trouve à 2,7 km du B&B HOTEL Aix-en-Provence Pont de l'Arc. L'aéroport de Marseille-Provence, le plus proche, est établi à 25 km.""]",21,Aix+en+Provence,43.5298424,5.4474738,"[25.8, 24.85, 27.14, 27.22, 28.37, 28.92, 28.37]","[5.89, 6.36, 6.22, 7.33, 3.6, 5.05, 6.18]","[1, 1, 0.03, 0, 0, 0, 0.25]",51.249
Aix en Provence,CORDELIERS MAIRIE,https://www.booking.com/hotel/fr/cordeliers-mairie.fr.html?aid=304142&label=gen173nr-1FCAQoggJCFnNlYXJjaF9haXgtZW4tcHJvdmVuY2VIDVgEaE2IAQGYAQ24AQfIAQzYAQHoAQH4AQOIAgGoAgO4Avbfh6QGwAIB0gIkYTE1NWMzZjQtMDE5Ny00ZGUxLWI3MWMtZjUwODU5ZDgxNjMz2AIF4AIB&ucfs=1&arphpl=1&group_adults=2&req_adults=2&no_rooms=1&group_children=0&req_children=0&hpos=16&hapos=16&sr_order=popularity&srpvid=15c56afb21ce032d&srepoch=1686237176&from=searchresults#hotelTmpl,"38 Rue des Cordeliers, 13100 Aix-en-Provence, France",43.5296463,5.4460289,5.7,"[""Doté d'une connexion Wi-Fi gratuite, le CORDELIERS MAIRIE est situé dans le centre d'Aix-en-Provence, à 31 km de la gare de Marseille Saint-Charles et de la station de métro Joliette. Cet appartement se trouve à 32 km du centre commercial Les Terrasses du Port et de la station de métro Vieux Port.\n\nCet appartement d'une chambre comprend un salon avec une télévision à écran plat et une kitchenette entièrement équipée.\n\nVous séjournerez à 32 km du musée des civilisations de l'Europe et de la Méditerranée et à 33 km de la rue Saint-Ferréol. L'aéroport de Marseille-Provence, le plus proche, est implanté à 27 km.""]",21,Aix+en+Provence,43.5298424,5.4474738,"[25.8, 24.85, 27.14, 27.22, 28.37, 28.92, 28.37]","[5.89, 6.36, 6.22, 7.33, 3.6, 5.05, 6.18]","[1, 1, 0.03, 0, 0, 0, 0.25]",51.249
Aix en Provence,Studio cosy Aix en Provence,https://www.booking.com/hotel/fr/studio-cosy-aix-en-provence.fr.html?aid=304142&label=gen173nr-1FCAQoggJCFnNlYXJjaF9haXgtZW4tcHJvdmVuY2VIDVgEaE2IAQGYAQ24AQfIAQzYAQHoAQH4AQOIAgGoAgO4Avbfh6QGwAIB0gIkYTE1NWMzZjQtMDE5Ny00ZGUxLWI3MWMtZjUwODU5ZDgxNjMz2AIF4AIB&ucfs=1&arphpl=1&group_adults=2&req_adults=2&no_rooms=1&group_children=0&req_children=0&hpos=1&hapos=1&sr_order=popularity&srpvid=15c56afb21ce032d&srepoch=1686237176&from=searchresults#hotelTmpl,"9 Rue des Bernardines, 13100 Aix-en-Provence, France",43.527618,5.4455675,0.0,"[""Doté d'une connexion Wi-Fi gratuite, le Studio cosy Aix en Provence est situé dans le centre d'Aix-en-Provence, à moins de 30 km de la gare de Marseille Saint-Charles et de la station de métro Joliette. Cet appartement se trouve à 32 km du musée des civilisations de l'Europe et de la Méditerranée et de la rue Saint-Ferréol.\nCet appartement climatisé comprend une chambre, une télévision à écran plat ainsi qu'une cuisine équipée d'un réfrigérateur et d'un four. Les serviettes et le linge de lit sont fournis.\nVous séjournerez à 31 km du centre commercial Les Terrasses du Port et à 32 km de la station de métro Vieux Port. L'aéroport de Marseille-Provence, le plus proche, est implanté à 26 km.""]",21,Aix+en+Provence,43.5298424,5.4474738,"[25.8, 24.85, 27.14, 27.22, 28.37, 28.92, 28.37]","[5.89, 6.36, 6.22, 7.33, 3.6, 5.05, 6.18]","[1, 1, 0.03, 0, 0, 0, 0.25]",51.249
Avignon,Villa Aigarden maison d'hôtes,https://www.booking.com/hotel/fr/villa-aigarden.fr.html?aid=304142&label=gen173nr-1FCAQoggJCDnNlYXJjaF9hdmlnbm9uSA1YBGhNiAEBmAENuAEHyAEM2AEB6AEB-AEDiAIBqAIDuAKy4IekBsACAdICJDhiYzdkOGFkLTNkNDMtNDBmOC05ZWFkLTZiM2I0MDQ5Yzc2ONgCBeACAQ&ucfs=1&arphpl=1&group_adults=2&req_adults=2&no_rooms=1&group_children=0&req_children=0&hpos=24&hapos=24&sr_order=popularity&srpvid=bb286b1902fd02c1&srepoch=1686237235&from=searchresults#hotelTmpl,"30 Avenue Saint-Jean, 84000 Avignon, France",43.9451031,4.8222035,9.8,"[""Située à Avignon, la Villa Aigarden maison d'hôtes propose un jardin, un barbecue, une terrasse bien exposée avec piscine et un petit-déjeuner à la carte. Vous séjournerez à 1,7 km de la gare centrale d'Avignon, à 1,7 km du palais des papes et à 5,8 km de la gare TGV d'Avignon. Une connexion Wi-Fi et un parking privé sont disponibles gratuitement.\nLes chambres comprennent une armoire. Leur salle de bains privative est pourvue d'une douche et d'un sèche-cheveux. Certaines chambres comprennent également un coin salon. Le linge de lit et les serviettes sont fournis.\nLors de votre séjour à la Villa Aigarden maison d'hôtes, vous pourrez pratiquer diverses activités à Avignon et dans les environs, telles que le vélo et la randonnée.\nVous séjournerez à 8,9 km du parc des expositions d'Avignon et à 39 km de l'amphithéâtre d'Arles. L'aéroport d'Avignon-Provence, le plus proche, est implanté à 8 km.""]",22,Avignon,43.9492493,4.8059012,"[26.17, 25.75, 25.74, 26.47, 27.31, 30.41, 29.32]","[5.26, 7.79, 10.16, 10.11, 7.43, 5.92, 7.33]","[0.96, 0.93, 0, 0, 0, 0, 0.29]",50.451
Avignon,Les Comtadins - PARKING Gratuit - Balcon - Clim,https://www.booking.com/hotel/fr/les-comtadins-parking-terrasse-clim.fr.html?aid=304142&label=gen173nr-1FCAQoggJCDnNlYXJjaF9hdmlnbm9uSA1YBGhNiAEBmAENuAEHyAEM2AEB6AEB-AEDiAIBqAIDuAKy4IekBsACAdICJDhiYzdkOGFkLTNkNDMtNDBmOC05ZWFkLTZiM2I0MDQ5Yzc2ONgCBeACAQ&ucfs=1&arphpl=1&group_adults=2&req_adults=2&no_rooms=1&group_children=0&req_children=0&hpos=17&hapos=17&sr_order=popularity&srpvid=bb286b1902fd02c1&srepoch=1686237235&from=searchresults#hotelTmpl,"20 Boulevard Limbert, 84000 Avignon, France",43.9458393,4.8170814,9.6,"[""Doté d'une terrasse, l'établissement Les Comtadins - PARKING Gratuit - Balcon - Clim est situé à Avignon, à 1,3 km du palais des Papes, à 5,5 km de la gare TGV d'Avignon et à 9,2 km du parc des expositions d'Avignon. Cet hébergement climatisé se trouve à 1,1 km de la gare centrale d'Avignon. Vous bénéficierez gratuitement d'une connexion Wi-Fi et d'un parking privé sur place.\nL'appartement comprend une télévision à écran plat. La cuisine est équipée d'un réfrigérateur, d'un four, d'un micro-ondes, d'une machine à café et d'une bouilloire.\nVous séjournerez à 39 km de l'amphithéâtre d'Arles et à 45 km du parc des expositions de Nîmes. L'aéroport d'Avignon-Provence, le plus proche, est à 9 km.""]",22,Avignon,43.9492493,4.8059012,"[26.17, 25.75, 25.74, 26.47, 27.31, 30.41, 29.32]","[5.26, 7.79, 10.16, 10.11, 7.43, 5.92, 7.33]","[0.96, 0.93, 0, 0, 0, 0, 0.29]",50.451
Avignon,Domaine de Rhodes B&B,https://www.booking.com/hotel/fr/domaine-de-rhodes.fr.html?aid=304142&label=gen173nr-1FCAQoggJCDnNlYXJjaF9hdmlnbm9uSA1YBGhNiAEBmAENuAEHyAEM2AEB6AEB-AEDiAIBqAIDuAKy4IekBsACAdICJDhiYzdkOGFkLTNkNDMtNDBmOC05ZWFkLTZiM2I0MDQ5Yzc2ONgCBeACAQ&ucfs=1&arphpl=1&group_adults=2&req_adults=2&no_rooms=1&group_children=0&req_children=0&hpos=18&hapos=18&sr_order=popularity&srpvid=bb286b1902fd02c1&srepoch=1686237235&from=searchresults#hotelTmpl,"486 chemin de Rhodes, 84000 Avignon, France",43.97451606,4.83258963,9.4,"[""Doté d'une piscine extérieure, le Domaine de Rhodes propose des hébergements avec petit-déjeuner à Avignon. Vous pourrez également profiter d'un jardin, d'une terrasse et d'une cheminée.\nOffrant une vue sur le jardin, chaque chambre non-fumeurs comprend un bureau, une connexion Wi-Fi gratuite et une salle de bains privative complète pourvue d'articles de toilette gratuits.\nUn petit-déjeuner continental composé de viennoiseries et de yaourts maison est servi chaque matin. Vous trouverez des restaurants, des bars et des magasins à 6 km.\nCette maison d'hôtes se trouve à 4 km de Pont d'Avignon, à 4,5 km du Palais des Papes et à 5,5 km de la gare de la ville. Un parking gratuit est disponible sur place.""]",22,Avignon,43.9492493,4.8059012,"[26.17, 25.75, 25.74, 26.47, 27.31, 30.41, 29.32]","[5.26, 7.79, 10.16, 10.11, 7.43, 5.92, 7.33]","[0.96, 0.93, 0, 0, 0, 0, 0.29]",50.451
Avignon,"Au cœur des Papes, dans bâtisse de charme studios & appartements en cœur de ville",https://www.booking.com/hotel/fr/au-coeur-des-papes.fr.html?aid=304142&label=gen173nr-1FCAQoggJCDnNlYXJjaF9hdmlnbm9uSA1YBGhNiAEBmAENuAEHyAEM2AEB6AEB-AEDiAIBqAIDuAKy4IekBsACAdICJDhiYzdkOGFkLTNkNDMtNDBmOC05ZWFkLTZiM2I0MDQ5Yzc2ONgCBeACAQ&ucfs=1&arphpl=1&group_adults=2&req_adults=2&no_rooms=1&group_children=0&req_children=0&hpos=9&hapos=9&sr_order=popularity&srpvid=bb286b1902fd02c1&srepoch=1686237235&from_sustainable_property_sr=1&from=searchresults#hotelTmpl,"5 Rue et Place Noël Antoine Biret, 84000 Avignon, France",43.9461706,4.8101887,9.0,"[""Doté d'une terrasse et d'une connexion Wi-Fi gratuite, l'établissement Au cœur des Papes, dans bâtisse de charme studios & appartements en cœur de ville est situé dans le centre d'Avignon, à proximité de la gare centrale, du palais des papes et du pont d'Avignon.\nLes logements comprennent la climatisation, une télévision à écran plat ainsi qu'une salle de bains privative pourvue d'une douche, d'articles de toilette gratuits et d'un sèche-cheveux. Un réfrigérateur, un micro-ondes, des plaques de cuisson, une machine à café et une bouilloire sont également fournis.\nVous séjournerez à 5,2 km de la gare TGV d'Avignon et à 10 km du parc des expositions d'Avignon. L'aéroport d'Avignon-Provence, le plus proche, est à 9 km.""]",22,Avignon,43.9492493,4.8059012,"[26.17, 25.75, 25.74, 26.47, 27.31, 30.41, 29.32]","[5.26, 7.79, 10.16, 10.11, 7.43, 5.92, 7.33]","[0.96, 0.93, 0, 0, 0, 0, 0.29]",50.451
Avignon,Les Cachettes,https://www.booking.com/hotel/fr/nos-cachettes.fr.html?aid=304142&label=gen173nr-1FCAQoggJCDnNlYXJjaF9hdmlnbm9uSA1YBGhNiAEBmAENuAEHyAEM2AEB6AEB-AEDiAIBqAIDuAKy4IekBsACAdICJDhiYzdkOGFkLTNkNDMtNDBmOC05ZWFkLTZiM2I0MDQ5Yzc2ONgCBeACAQ&ucfs=1&arphpl=1&group_adults=2&req_adults=2&no_rooms=1&group_children=0&req_children=0&hpos=14&hapos=14&sr_order=popularity&srpvid=bb286b1902fd02c1&srepoch=1686237235&from=searchresults#hotelTmpl,"6 Rue des Bains, 84000 Avignon, France",43.95098994,4.81063021,8.9,"[""Vous pouvez bénéficier d'une réduction Genius dans l'établissement Les Cachettes ! Connectez-vous pour économiser.\nSitué à 300 mètres du Palais des papes, le Les Cachettes dispose d'une connexion Wi-Fi gratuite.\nLes logements comprennent tous un coin salon et une télévision par satellite à écran plat. Leur cuisine entièrement équipée possède un four, un lave-vaisselle, une bouilloire et une machine à café.\nLe Les Cachettes se situe à 1,2 km du pont d'Avignon et à 11 km de l'aéroport d'Avignon-Provence.""]",22,Avignon,43.9492493,4.8059012,"[26.17, 25.75, 25.74, 26.47, 27.31, 30.41, 29.32]","[5.26, 7.79, 10.16, 10.11, 7.43, 5.92, 7.33]","[0.96, 0.93, 0, 0, 0, 0, 0.29]",50.451
Avignon,CLIMATISATION-Hypercentre-PARKING-COSY CARNOT-AVIGNONSMILE,https://www.booking.com/hotel/fr/hypercentre-cosy-carnot-avignonsmile.fr.html?aid=304142&label=gen173nr-1FCAQoggJCDnNlYXJjaF9hdmlnbm9uSA1YBGhNiAEBmAENuAEHyAEM2AEB6AEB-AEDiAIBqAIDuAKy4IekBsACAdICJDhiYzdkOGFkLTNkNDMtNDBmOC05ZWFkLTZiM2I0MDQ5Yzc2ONgCBeACAQ&ucfs=1&arphpl=1&group_adults=2&req_adults=2&no_rooms=1&group_children=0&req_children=0&hpos=25&hapos=25&sr_order=popularity&srpvid=bb286b1902fd02c1&srepoch=1686237235&from=searchresults#hotelTmpl,"46-48 Rue Carnot, 84000 Avignon, France",43.94917757,4.81083119,8.5,"[""Vous pouvez bénéficier d'une réduction Genius dans l'établissement CLIMATISATION-Hypercentre-PARKING-COSY CARNOT-AVIGNONSMILE ! Connectez-vous pour économiser.\nSitué dans le centre d'Avignon, à seulement 500 mètres du palais des Papes et à 1,1 km de la gare centrale, le CLIMATISATION-Hypercentre-PARKING-COSY CARNOT-AVIGNONSMILE propose un hébergement avec vue sur la ville et connexion Wi-Fi gratuite. Cet appartement se trouve à 5,8 km de la gare TGV d'Avignon et à 10 km du parc des expositions d'Avignon.\nCet appartement climatisé comprend une chambre, un salon, une cuisine entièrement équipée avec un réfrigérateur et une machine à café ainsi qu'une salle de bains pourvue d'une douche et d'articles de toilette gratuits. Les serviettes et le linge de lit sont fournis.\nVous séjournerez à 39 km de l'amphithéâtre d'Arles et à 45 km du parc des expositions de Nîmes. L'aéroport le plus proche, celui d'Avignon-Provence, est situé à 10 km.""]",22,Avignon,43.9492493,4.8059012,"[26.17, 25.75, 25.74, 26.47, 27.31, 30.41, 29.32]","[5.26, 7.79, 10.16, 10.11, 7.43, 5.92, 7.33]","[0.96, 0.93, 0, 0, 0, 0, 0.29]",50.451
Avignon,Be Loft B&B Pool & Spa,https://www.booking.com/hotel/fr/be-loft.fr.html?aid=304142&label=gen173nr-1FCAQoggJCDnNlYXJjaF9hdmlnbm9uSA1YBGhNiAEBmAENuAEHyAEM2AEB6AEB-AEDiAIBqAIDuAKy4IekBsACAdICJDhiYzdkOGFkLTNkNDMtNDBmOC05ZWFkLTZiM2I0MDQ5Yzc2ONgCBeACAQ&ucfs=1&arphpl=1&group_adults=2&req_adults=2&no_rooms=1&group_children=0&req_children=0&hpos=21&hapos=21&sr_order=popularity&srpvid=bb286b1902fd02c1&srepoch=1686237235&from_sustainable_property_sr=1&from=searchresults#hotelTmpl,"15 Avenue de l' Arrousaire, 84000 Avignon, France",43.9403371,4.81174964,8.4,"[""Vous pouvez bénéficier d'une réduction Genius dans l'établissement Be Loft B&B Pool & Spa ! Connectez-vous pour économiser.\nDoté d'une salle de sport, le Be Loft B&B Pool & Spa se situe à Avignon, à 1,5 km du palais des papes. Cette chambre d'hôtes possède un bar, une terrasse et une piscine extérieure ouverte en saison.\nLes chambres comprennent un lecteur CD et une télévision par câble à écran plat. Vous pourrez savourer une tasse de café sur votre patio ou sur votre terrasse. Chaque logement comporte aussi une salle de bains privative, certaines étant munies d'une baignoire spa ou d'une douche. Des peignoirs, des chaussons et des articles de toilette gratuits sont fournis. Une télévision par satellite est aussi mise à votre disposition.\nLe Be Loft B&B Pool & Spa est pourvu d'un salon commun.\nL'aéroport d'Avignon-Provence se trouve à 8 km.""]",22,Avignon,43.9492493,4.8059012,"[26.17, 25.75, 25.74, 26.47, 27.31, 30.41, 29.32]","[5.26, 7.79, 10.16, 10.11, 7.43, 5.92, 7.33]","[0.96, 0.93, 0, 0, 0, 0, 0.29]",50.451
